{
  "$schema": "./schemas/models-catalog.schema.json",
  "version": "1.0.0",
  "description": "Machine-readable catalog of all ADML dynamical models",
  "models": [
    {
      "name": "Dahlquist",
      "package": "adml-dahlquist",
      "path": "models/mathematical/dahlquist",
      "category": "mathematical",
      "version": "1.0.0",
      "complexity": "simple",
      "states": 1,
      "parameters": 1,
      "features": [
        "analytical_solution",
        "single_state",
        "linear"
      ],
      "equations": [
        "dx/dt = -k * x"
      ],
      "fmu_name": "Dahlquist.fmu",
      "description": "Simple exponential decay test equation. Useful for testing numerical integration."
    },
    {
      "name": "VanDerPol",
      "package": "adml-van-der-pol",
      "path": "models/mathematical/van-der-pol",
      "category": "mathematical",
      "version": "1.0.0",
      "complexity": "medium",
      "states": 2,
      "parameters": 1,
      "features": [
        "multi_state",
        "nonlinear",
        "limit_cycle"
      ],
      "equations": [
        "dx0/dt = x1",
        "dx1/dt = mu * (1 - x0^2) * x1 - x0"
      ],
      "fmu_name": "VanDerPol.fmu",
      "description": "Nonlinear oscillator exhibiting limit cycle behavior."
    },
    {
      "name": "BouncingBall",
      "package": "adml-bouncing-ball",
      "path": "models/mechanical/bouncing-ball",
      "category": "mechanical",
      "version": "1.0.0",
      "complexity": "advanced",
      "states": 2,
      "parameters": 3,
      "features": [
        "event_handling",
        "hybrid_dynamics",
        "energy_dissipation"
      ],
      "equations": [
        "dh/dt = v",
        "dv/dt = -g",
        "Event: h <= 0 triggers v = -e * v"
      ],
      "fmu_name": "BouncingBall.fmu",
      "description": "Ball falling under gravity with elastic collisions at ground level."
    },
    {
      "name": "SimplePendulum",
      "package": "adml-simple-pendulum",
      "path": "models/mechanical/simple-pendulum",
      "category": "mechanical",
      "version": "1.0.0",
      "complexity": "medium",
      "states": 2,
      "parameters": 4,
      "features": [
        "multi_state",
        "nonlinear",
        "energy_conservation",
        "damping",
        "small_angle_approximation"
      ],
      "equations": [
        "dtheta/dt = omega",
        "domega/dt = -(g/L) * sin(theta) - (b/m) * omega"
      ],
      "fmu_name": "SimplePendulum.fmu",
      "description": "Classical simple pendulum with nonlinear dynamics and optional damping."
    },
    {
      "name": "RcThermalSingleZone",
      "package": "adml-rc-thermal-single-zone",
      "path": "models/thermal/rc-thermal-single-zone",
      "category": "thermal",
      "version": "1.0.0",
      "complexity": "simple",
      "states": 1,
      "parameters": 4,
      "features": [
        "single_state",
        "linear",
        "steady_state",
        "thermal_dynamics"
      ],
      "equations": [
        "dT_indoor/dt = (Q_heat - (T_indoor - T_ambient) / R_th) / C_th"
      ],
      "fmu_name": "RcThermalSingleZone.fmu",
      "description": "Single-zone thermal model using RC circuit analogy for building simulation."
    }
  ],
  "categories": {
    "mathematical": {
      "description": "Abstract mathematical models for testing and demonstration",
      "count": 2
    },
    "mechanical": {
      "description": "Classical mechanical systems",
      "count": 2
    },
    "thermal": {
      "description": "Thermal and heat transfer models",
      "count": 1
    }
  },
  "statistics": {
    "total_models": 5,
    "simple_models": 2,
    "medium_models": 2,
    "advanced_models": 1
  }
}
